[
  {
    "schema_version": "0.1.0",
    "id": "skardu/hidden_lakes/upper_kachura",
    "catalog_id": null,
    "geometry": { "type": "Point", "coordinates": [75.4454, 35.4467] },
    "known": true,
    "interesting": true,
    "human_rating": 8.8,
    "google_maps_popularity": 4.5,
    "tags": ["lake", "alpine", "solitude"],
    "ontology_ids": ["water.lake", "experience.discovery", "experience.solitude"],
    "notes": "Provisional curator seed (v0): Upper Kachura (Foroq Tso). Coords from GB tourism listing. Lower Kachura/Shangrila omitted as opposite control — real separation is < 2× match_radius and would poison distance matching. Ratings pending field verification.",
    "license": "CC-BY-4.0",
    "synthetic": false
  },
  {
    "schema_version": "0.1.0",
    "id": "skardu/hidden_lakes/sheosar",
    "catalog_id": null,
    "geometry": { "type": "Point", "coordinates": [75.2439, 34.99136] },
    "known": true,
    "interesting": true,
    "human_rating": 9.3,
    "google_maps_popularity": 5.5,
    "tags": ["lake", "deosai", "alpine"],
    "ontology_ids": ["water.lake", "terrain.scenic", "experience.photography"],
    "notes": "Provisional curator seed (v0): Sheosar Lake on Deosai. Coords aligned to published field study. Ratings pending field verification.",
    "license": "CC-BY-4.0",
    "synthetic": false
  },
  {
    "schema_version": "0.1.0",
    "id": "skardu/hidden_lakes/kharfaq",
    "catalog_id": null,
    "geometry": { "type": "Point", "coordinates": [76.20528, 35.17139] },
    "known": false,
    "interesting": true,
    "human_rating": 8.6,
    "google_maps_popularity": 2.0,
    "tags": ["lake", "remote"],
    "ontology_ids": ["water.lake", "experience.remote", "experience.discovery"],
    "notes": "Provisional curator seed (v0): Kharfaq Lake (Ghanche / Kharfaq village area — not Kharmang). Coords from Wikipedia. Ratings pending field verification.",
    "license": "CC-BY-4.0",
    "synthetic": false
  },
  {
    "schema_version": "0.1.0",
    "id": "skardu/hidden_lakes/blind_lake",
    "catalog_id": null,
    "geometry": { "type": "Point", "coordinates": [75.69833, 35.36222] },
    "known": true,
    "interesting": true,
    "human_rating": 8.0,
    "google_maps_popularity": 5.5,
    "tags": ["lake", "zharba", "shigar"],
    "ontology_ids": ["water.lake", "experience.photography", "experience.quiet"],
    "notes": "Provisional curator seed (v0): Blind Lake / Zharba Tso between Skardu and Shigar. Coords from Wikipedia. Moderately known roadside lake — still explorer-list worthy vs fort/resort traps. Ratings pending field verification.",
    "license": "CC-BY-4.0",
    "synthetic": false
  },
  {
    "schema_version": "0.1.0",
    "id": "skardu/hidden_lakes/basho_pools",
    "catalog_id": null,
    "geometry": { "type": "Point", "coordinates": [75.248, 35.378] },
    "known": false,
    "interesting": true,
    "human_rating": 8.7,
    "google_maps_popularity": 2.2,
    "tags": ["lake", "valley", "forest"],
    "ontology_ids": ["water.lake", "vegetation.forest", "experience.discovery"],
    "notes": "Provisional curator seed (v0): Basho Valley quiet waterbodies off main picnic spots. Approximate public geography; ratings pending field verification.",
    "license": "CC-BY-4.0",
    "synthetic": false
  },
  {
    "schema_version": "0.1.0",
    "id": "skardu/hidden_lakes/satpara_quiet_shore",
    "catalog_id": null,
    "geometry": { "type": "Point", "coordinates": [75.580, 35.290] },
    "known": true,
    "interesting": true,
    "human_rating": 7.9,
    "google_maps_popularity": 3.5,
    "tags": ["lake", "shore"],
    "ontology_ids": ["water.lake", "experience.quiet", "experience.photography"],
    "notes": "Provisional curator seed (v0): Satpara quiet shore anchor offset from dam/parking control so opposite-interesting separation > 2× match_radius. Ratings pending field verification.",
    "license": "CC-BY-4.0",
    "synthetic": false
  }
]
