[
  {
    "schema_version": "0.1.0",
    "id": "skardu/controls/kharpocho_fort",
    "catalog_id": null,
    "geometry": { "type": "Point", "coordinates": [75.644, 35.297] },
    "known": true,
    "interesting": false,
    "human_rating": 5.0,
    "google_maps_popularity": 8.8,
    "tags": ["fort", "viewpoint", "control"],
    "ontology_ids": ["experience.history", "terrain.viewpoint", "experience.crowds"],
    "notes": "Provisional curator seed (v0): Kharpocho Fort — classic Skardu tourist stop. Approximate public geography; ratings pending field verification.",
    "license": "CC-BY-4.0",
    "synthetic": false
  },
  {
    "schema_version": "0.1.0",
    "id": "skardu/controls/manthal_buddha",
    "catalog_id": null,
    "geometry": { "type": "Point", "coordinates": [75.633, 35.285] },
    "known": true,
    "interesting": false,
    "human_rating": 4.8,
    "google_maps_popularity": 8.5,
    "tags": ["heritage", "control"],
    "ontology_ids": ["experience.history", "experience.crowds"],
    "notes": "Provisional curator seed (v0): Manthal Buddha Rock — high foot traffic control. Same-polarity neighbor of Kharpocho (< match_radius) is OK; both are tourist traps. Ratings pending field verification.",
    "license": "CC-BY-4.0",
    "synthetic": false
  },
  {
    "schema_version": "0.1.0",
    "id": "skardu/controls/satpara_dam_viewpoint",
    "catalog_id": null,
    "geometry": { "type": "Point", "coordinates": [75.545, 35.318] },
    "known": true,
    "interesting": false,
    "human_rating": 5.2,
    "google_maps_popularity": 8.0,
    "tags": ["lake", "dam", "control"],
    "ontology_ids": ["water.lake", "terrain.viewpoint", "experience.crowds"],
    "notes": "Provisional curator seed (v0): Satpara dam / main parking viewpoint — paired with quiet-shore interesting label at > 2× match_radius. Ratings pending field verification.",
    "license": "CC-BY-4.0",
    "synthetic": false
  },
  {
    "schema_version": "0.1.0",
    "id": "skardu/controls/katpana_resort_strip",
    "catalog_id": null,
    "geometry": { "type": "Point", "coordinates": [75.555, 35.355] },
    "known": true,
    "interesting": false,
    "human_rating": 4.5,
    "google_maps_popularity": 8.6,
    "tags": ["desert", "resort", "control"],
    "ontology_ids": ["terrain.scenic", "experience.crowds", "experience.photography"],
    "notes": "Provisional curator seed (v0): Katpana cold-desert resort / selfie strip — paired with quiet-dunes interesting label at > 2× match_radius. Ratings pending field verification.",
    "license": "CC-BY-4.0",
    "synthetic": false
  },
  {
    "schema_version": "0.1.0",
    "id": "skardu/controls/shigar_fort",
    "catalog_id": null,
    "geometry": { "type": "Point", "coordinates": [75.738, 35.423] },
    "known": true,
    "interesting": false,
    "human_rating": 5.4,
    "google_maps_popularity": 8.3,
    "tags": ["fort", "heritage", "control"],
    "ontology_ids": ["experience.history", "experience.crowds"],
    "notes": "Provisional curator seed (v0): Shigar Fort — heritage tourist control (contrast side-valley label). Ratings pending field verification.",
    "license": "CC-BY-4.0",
    "synthetic": false
  }
]
